{
  "$schema": "../schemas/data-fitness-matrix.schema.json",
  "registry_version": "1.0.0",
  "release_version": "1.0.0",
  "unknown_source_policy": "reject_unlisted",
  "backtest_admission": "backtest_safe_only",
  "reachable_surfaces": {
    "catalog_datasets": ["filings", "fundamentals", "fx", "macroeconomics", "prices"],
    "backtest_input_kinds": ["calendar", "corporate_actions", "feature", "fx", "macro", "membership", "prices", "risk_free"],
    "feature_sets": ["fundamental-growth", "macro-state", "market-basic", "market-momentum"],
    "workflow_evidence": ["commodity"]
  },
  "source_codes": [
    "acceptance_fixture",
    "alfred",
    "b3",
    "b3_action_replay",
    "b3_calendar_history",
    "b3_cotahist",
    "b3_listing_history",
    "b3_membership",
    "bcb",
    "bcb_ptax",
    "config_universe",
    "cvm_ipe",
    "fred",
    "invs",
    "nasdaq_calendar_history",
    "nasdaq_membership",
    "nyse",
    "sec",
    "yahoo"
  ],
  "entries": [
    {
      "id": "backtest-calendar-fixture",
      "dataset": "calendar",
      "source": "acceptance_fixture",
      "contract_version": "1.0.0",
      "feature_set": null,
      "authority": {"name": "INVS deterministic v0.5 acceptance fixture", "reference": "python/research/backtest_acceptance.py", "access_status": "fixture_only"},
      "access": {"mode": "fixture", "credentials": "none", "unattended": true},
      "coverage": {"regions": ["BR", "US"], "entities": "bounded acceptance securities", "fields": ["session_date", "open_at", "close_at", "available_at"], "start": "2025-01-02", "end": "2025-01-23", "frequency": "daily sessions", "known_gaps": ["synthetic availability and hours", "not production exchange coverage"]},
      "time_semantics": {"observed": "fixture session date", "published": "fixture envelope availability", "available": "explicit fixture available_at", "precision": "second", "historical_availability": "source_declared", "decision_rule": "use only sessions available by the decision or execution clock"},
      "revision_policy": "append",
      "historical_fitness": "backtest_safe",
      "identity_policy": {"natural_key": "region plus session_date", "mapping_source": "fixture-defined security universe", "historical_identity": "fixture_defined"},
      "quality_checks": ["strict row shape", "unique session dates", "ordered UTC session clocks", "manifest hash verification"],
      "evidence": [{"kind": "acceptance", "path": "docs/acceptance/2026-08-29-v0.5-backtesting.md", "commit": null, "status": "accepted"}],
      "consumers": ["backtest", "paper", "acceptance"],
      "backtest_input_kinds": ["calendar"],
      "notes": "The only admitted backtest calendar in the retained deterministic simulation is an explicitly hash-pinned fixture; live exchange calendars remain separately classified."
    },
    {
      "id": "backtest-corporate-actions-fixture",
      "dataset": "corporate_actions",
      "source": "acceptance_fixture",
      "contract_version": "1.0.0",
      "feature_set": null,
      "authority": {"name": "INVS deterministic v0.5 acceptance fixture", "reference": "python/research/backtest_acceptance.py", "access_status": "fixture_only"},
      "access": {"mode": "fixture", "credentials": "none", "unattended": true},
      "coverage": {"regions": ["BR", "US"], "entities": "bounded acceptance securities", "fields": ["split", "cash_dividend", "delisting", "effective_date", "payment_date"], "start": "2025-01-02", "end": "2025-01-23", "frequency": "event", "known_gaps": ["synthetic event history", "not a complete action archive"]},
      "time_semantics": {"observed": "fixture effective event date", "published": "fixture envelope availability", "available": "explicit fixture available_at", "precision": "second", "historical_availability": "source_declared", "decision_rule": "apply only actions available by the event decision clock"},
      "revision_policy": "append",
      "historical_fitness": "backtest_safe",
      "identity_policy": {"natural_key": "action id plus security id", "mapping_source": "fixture-defined security universe", "historical_identity": "fixture_defined"},
      "quality_checks": ["supported action-state validation", "unique action IDs", "effective/payment ordering", "manifest hash verification"],
      "evidence": [{"kind": "acceptance", "path": "docs/acceptance/2026-08-29-v0.5-backtesting.md", "commit": null, "status": "accepted"}],
      "consumers": ["backtest", "paper", "adjustments", "acceptance"],
      "backtest_input_kinds": ["corporate_actions"],
      "notes": "This fixture is the accepted backtest action path; unsupported or unaccounted source actions must block a simulation."
    },
    {
      "id": "backtest-fx-fixture",
      "dataset": "fx",
      "source": "acceptance_fixture",
      "contract_version": "1.0.0",
      "feature_set": null,
      "authority": {"name": "INVS deterministic v0.5 acceptance fixture", "reference": "python/research/backtest_acceptance.py", "access_status": "fixture_only"},
      "access": {"mode": "fixture", "credentials": "none", "unattended": true},
      "coverage": {"regions": ["BR", "US"], "entities": "USD/BRL acceptance conversion", "fields": ["fixing_at", "base_currency", "quote_currency", "rate", "available_at"], "start": "2025-01-02", "end": "2025-01-23", "frequency": "daily fixing", "known_gaps": ["synthetic rates", "no currency pairs beyond the fixture"]},
      "time_semantics": {"observed": "fixture fixing instant", "published": "fixture envelope availability", "available": "explicit fixture available_at", "precision": "second", "historical_availability": "source_declared", "decision_rule": "select the latest exact pair fixing available at valuation time"},
      "revision_policy": "append",
      "historical_fitness": "backtest_safe",
      "identity_policy": {"natural_key": "currency pair plus fixing_at", "mapping_source": "fixture-defined pair", "historical_identity": "fixture_defined"},
      "quality_checks": ["positive rates", "no duplicate pair fixings", "point-in-time availability", "manifest hash verification"],
      "evidence": [{"kind": "acceptance", "path": "docs/acceptance/2026-08-29-v0.5-backtesting.md", "commit": null, "status": "accepted"}],
      "consumers": ["backtest", "paper", "acceptance"],
      "backtest_input_kinds": ["fx"],
      "notes": "The fixture proves the simulation clock and conversion boundary; it does not broaden the admitted production FX universe."
    },
    {
      "id": "backtest-membership-fixture",
      "dataset": "membership",
      "source": "acceptance_fixture",
      "contract_version": "1.0.0",
      "feature_set": null,
      "authority": {"name": "INVS deterministic v0.5 acceptance fixture", "reference": "python/research/backtest_acceptance.py", "access_status": "fixture_only"},
      "access": {"mode": "fixture", "credentials": "none", "unattended": true},
      "coverage": {"regions": ["BR", "US"], "entities": "bounded acceptance universes", "fields": ["security_id", "valid_from", "valid_until", "member", "available_at", "revision"], "start": "2025-01-02", "end": "2025-01-23", "frequency": "versioned interval", "known_gaps": ["synthetic membership history", "not a benchmark membership archive"]},
      "time_semantics": {"observed": "membership validity interval", "published": "fixture revision availability", "available": "explicit fixture available_at", "precision": "second", "historical_availability": "source_declared", "decision_rule": "resolve the latest non-conflicting assertion known at decision time"},
      "revision_policy": "append",
      "historical_fitness": "backtest_safe",
      "identity_policy": {"natural_key": "security id plus validity interval and revision", "mapping_source": "fixture-defined security universe", "historical_identity": "fixture_defined"},
      "quality_checks": ["interval ordering", "non-overlapping assertions", "revision tie conflict detection", "manifest hash verification"],
      "evidence": [{"kind": "acceptance", "path": "docs/acceptance/2026-08-29-v0.5-backtesting.md", "commit": null, "status": "accepted"}],
      "consumers": ["backtest", "paper", "acceptance"],
      "backtest_input_kinds": ["membership"],
      "notes": "Backtests require explicit membership rows; current universe configuration is never silently substituted."
    },
    {
      "id": "backtest-prices-fixture",
      "dataset": "prices",
      "source": "acceptance_fixture",
      "contract_version": "1.0.0",
      "feature_set": null,
      "authority": {"name": "INVS deterministic v0.5 acceptance fixture", "reference": "python/research/backtest_acceptance.py", "access_status": "fixture_only"},
      "access": {"mode": "fixture", "credentials": "none", "unattended": true},
      "coverage": {"regions": ["BR", "US"], "entities": "bounded acceptance securities", "fields": ["open", "high", "low", "close", "volume", "currency"], "start": "2025-01-02", "end": "2025-01-23", "frequency": "daily", "known_gaps": ["synthetic prices", "not a live market feed"]},
      "time_semantics": {"observed": "fixture session date", "published": "fixture envelope availability", "available": "explicit fixture available_at", "precision": "second", "historical_availability": "source_declared", "decision_rule": "use only rows whose observed and available clocks precede the event"},
      "revision_policy": "append",
      "historical_fitness": "backtest_safe",
      "identity_policy": {"natural_key": "security id plus session date", "mapping_source": "fixture-defined security universe", "historical_identity": "fixture_defined"},
      "quality_checks": ["OHLC containment", "positive price validation", "unique security/session rows", "manifest hash verification"],
      "evidence": [{"kind": "acceptance", "path": "docs/acceptance/2026-08-29-v0.5-backtesting.md", "commit": null, "status": "accepted"}],
      "consumers": ["backtest", "paper", "acceptance"],
      "backtest_input_kinds": ["prices"],